{
  "atlas_delta_id": "atlas_delta:closed_loop:profile_05_a3:batch_1",
  "confidence_changes": [
    {
      "confidence_basis": "mission_signal_pattern",
      "delta": 0.08,
      "direction": "up",
      "evidence_refs": [
        {
          "ref_type": "signal",
          "signal_id": "signal:mission:profile_05_A3:001"
        }
      ],
      "prior_confidence": null,
      "review_required": true,
      "target_ref": {
        "label": "candidate:public_profile_05:kendrick_dense_anchor_with_exception",
        "source_candidate_id": "possible_update:signal:mission:profile_05_A3:001",
        "target_id": "candidate_public_profile_05_kendrick_dense_anchor_with_exception",
        "target_type": "track"
      },
      "updated_confidence": null
    },
    {
      "confidence_basis": "mission_signal_pattern",
      "delta": 0.0,
      "direction": "flat",
      "evidence_refs": [
        {
          "ref_type": "signal",
          "signal_id": "signal:mission:profile_05_A3:002"
        }
      ],
      "prior_confidence": null,
      "review_required": true,
      "target_ref": {
        "label": "candidate:public_profile_05:kendrick_dense_anchor_with_exception",
        "source_candidate_id": "possible_update:signal:mission:profile_05_A3:002",
        "target_id": "candidate_public_profile_05_kendrick_dense_anchor_with_exception",
        "target_type": "track"
      },
      "updated_confidence": null
    },
    {
      "confidence_basis": "mission_signal_pattern",
      "delta": 0.12,
      "direction": "up",
      "evidence_refs": [
        {
          "ref_type": "signal",
          "signal_id": "signal:mission:profile_05_A3:003"
        }
      ],
      "prior_confidence": null,
      "review_required": true,
      "target_ref": {
        "label": "candidate:public_profile_05:sza_frank_sade_landmark_reinforcement",
        "source_candidate_id": "possible_update:signal:mission:profile_05_A3:003",
        "target_id": "candidate_public_profile_05_sza_frank_sade_landmark_reinforcement",
        "target_type": "track"
      },
      "updated_confidence": null
    },
    {
      "confidence_basis": "mission_signal_pattern",
      "delta": 0.08,
      "direction": "up",
      "evidence_refs": [
        {
          "ref_type": "signal",
          "signal_id": "signal:mission:profile_05_A3:004"
        }
      ],
      "prior_confidence": null,
      "review_required": true,
      "target_ref": {
        "label": "candidate:public_profile_05:sza_frank_sade_landmark_reinforcement",
        "source_candidate_id": "possible_update:signal:mission:profile_05_A3:004",
        "target_id": "candidate_public_profile_05_sza_frank_sade_landmark_reinforcement",
        "target_type": "track"
      },
      "updated_confidence": null
    },
    {
      "confidence_basis": "mission_signal_pattern",
      "delta": 0.0,
      "direction": "flat",
      "evidence_refs": [
        {
          "ref_type": "signal",
          "signal_id": "signal:mission:profile_05_A3:005"
        }
      ],
      "prior_confidence": null,
      "review_required": true,
      "target_ref": {
        "label": "candidate:public_profile_05:sza_frank_sade_landmark_reinforcement",
        "source_candidate_id": "possible_update:signal:mission:profile_05_A3:005",
        "target_id": "candidate_public_profile_05_sza_frank_sade_landmark_reinforcement",
        "target_type": "track"
      },
      "updated_confidence": null
    },
    {
      "confidence_basis": "mission_signal_pattern",
      "delta": 0.08,
      "direction": "up",
      "evidence_refs": [
        {
          "ref_type": "signal",
          "signal_id": "signal:mission:profile_05_A3:006"
        }
      ],
      "prior_confidence": null,
      "review_required": true,
      "target_ref": {
        "label": "candidate:public_profile_05:sza_frank_sade_landmark_reinforcement",
        "source_candidate_id": "possible_update:signal:mission:profile_05_A3:006",
        "target_id": "candidate_public_profile_05_sza_frank_sade_landmark_reinforcement",
        "target_type": "track"
      },
      "updated_confidence": null
    },
    {
      "confidence_basis": "mission_signal_pattern",
      "delta": 0.0,
      "direction": "flat",
      "evidence_refs": [
        {
          "ref_type": "signal",
          "signal_id": "signal:mission:profile_05_A3:007"
        }
      ],
      "prior_confidence": null,
      "review_required": true,
      "target_ref": {
        "label": "candidate:public_profile_05:crazy_in_love_frontier_probe",
        "source_candidate_id": "possible_update:signal:mission:profile_05_A3:007",
        "target_id": "candidate_public_profile_05_crazy_in_love_frontier_probe",
        "target_type": "track"
      },
      "updated_confidence": null
    },
    {
      "confidence_basis": "mission_signal_pattern",
      "delta": 0.0,
      "direction": "flat",
      "evidence_refs": [
        {
          "ref_type": "signal",
          "signal_id": "signal:mission:profile_05_A3:008"
        }
      ],
      "prior_confidence": null,
      "review_required": true,
      "target_ref": {
        "label": "candidate:public_profile_05:crazy_in_love_frontier_probe",
        "source_candidate_id": "possible_update:signal:mission:profile_05_A3:008",
        "target_id": "candidate_public_profile_05_crazy_in_love_frontier_probe",
        "target_type": "track"
      },
      "updated_confidence": null
    },
    {
      "confidence_basis": "mission_signal_pattern",
      "delta": 0.05,
      "direction": "up",
      "evidence_refs": [
        {
          "ref_type": "signal",
          "signal_id": "signal:mission:profile_05_A3:009"
        }
      ],
      "prior_confidence": null,
      "review_required": true,
      "target_ref": {
        "label": "candidate:public_profile_05:crazy_in_love_frontier_probe",
        "source_candidate_id": "possible_update:signal:mission:profile_05_A3:009",
        "target_id": "candidate_public_profile_05_crazy_in_love_frontier_probe",
        "target_type": "track"
      },
      "updated_confidence": null
    },
    {
      "confidence_basis": "mission_signal_pattern",
      "delta": 0.0,
      "direction": "flat",
      "evidence_refs": [
        {
          "ref_type": "signal",
          "signal_id": "signal:mission:profile_05_A3:010"
        }
      ],
      "prior_confidence": null,
      "review_required": true,
      "target_ref": {
        "label": "candidate:public_profile_05:shania_twain_scope_warning",
        "source_candidate_id": "possible_update:signal:mission:profile_05_A3:010",
        "target_id": "candidate_public_profile_05_shania_twain_scope_warning",
        "target_type": "track"
      },
      "updated_confidence": null
    },
    {
      "confidence_basis": "mission_signal_pattern",
      "delta": -0.08,
      "direction": "down",
      "evidence_refs": [
        {
          "ref_type": "signal",
          "signal_id": "signal:mission:profile_05_A3:011"
        }
      ],
      "prior_confidence": null,
      "review_required": true,
      "target_ref": {
        "label": "candidate:public_profile_05:shania_twain_scope_warning",
        "source_candidate_id": "possible_update:signal:mission:profile_05_A3:011",
        "target_id": "candidate_public_profile_05_shania_twain_scope_warning",
        "target_type": "track"
      },
      "updated_confidence": null
    },
    {
      "confidence_basis": "mission_signal_pattern",
      "delta": 0.0,
      "direction": "flat",
      "evidence_refs": [
        {
          "ref_type": "signal",
          "signal_id": "signal:mission:profile_05_A3:012"
        }
      ],
      "prior_confidence": null,
      "review_required": true,
      "target_ref": {
        "label": "candidate:public_profile_05:shania_twain_scope_warning",
        "source_candidate_id": "possible_update:signal:mission:profile_05_A3:012",
        "target_id": "candidate_public_profile_05_shania_twain_scope_warning",
        "target_type": "track"
      },
      "updated_confidence": null
    },
    {
      "confidence_basis": "mission_signal_pattern",
      "delta": 0.08,
      "direction": "up",
      "evidence_refs": [
        {
          "ref_type": "signal",
          "signal_id": "signal:mission:profile_05_A3:013"
        }
      ],
      "prior_confidence": null,
      "review_required": true,
      "target_ref": {
        "label": "candidate:public_profile_05:sza_frank_sade_landmark_reinforcement",
        "source_candidate_id": "possible_update:signal:mission:profile_05_A3:013",
        "target_id": "candidate_public_profile_05_sza_frank_sade_landmark_reinforcement",
        "target_type": "track"
      },
      "updated_confidence": null
    },
    {
      "confidence_basis": "mission_signal_pattern",
      "delta": 0.0,
      "direction": "flat",
      "evidence_refs": [
        {
          "ref_type": "signal",
          "signal_id": "signal:mission:profile_05_A3:014"
        }
      ],
      "prior_confidence": null,
      "review_required": true,
      "target_ref": {
        "label": "candidate:public_profile_05:kendrick_dense_anchor_with_exception",
        "source_candidate_id": "possible_update:signal:mission:profile_05_A3:014",
        "target_id": "candidate_public_profile_05_kendrick_dense_anchor_with_exception",
        "target_type": "track"
      },
      "updated_confidence": null
    },
    {
      "confidence_basis": "mission_signal_pattern",
      "delta": 0.08,
      "direction": "up",
      "evidence_refs": [
        {
          "ref_type": "signal",
          "signal_id": "signal:mission:profile_05_A3:015"
        }
      ],
      "prior_confidence": null,
      "review_required": true,
      "target_ref": {
        "label": "candidate:public_profile_05:sza_frank_sade_landmark_reinforcement",
        "source_candidate_id": "possible_update:signal:mission:profile_05_A3:015",
        "target_id": "candidate_public_profile_05_sza_frank_sade_landmark_reinforcement",